{
  "specification_id": "SPEC-004",
  "specification_version": "candidate-0.1",
  "status": "CANDIDATE_NONCANONICAL",
  "test_id": "TV-006",
  "name": "Egress payload 2 MiB boundary",
  "input": {
    "payload_size_bytes": 2097152,
    "max_payload_bytes": 2097152,
    "over_limit_size_bytes": 2097153
  },
  "expected": {
    "status": "PASS",
    "accepted_bytes": 2097152,
    "over_limit_status": "REJECT"
  },
  "anchor": "e09a8224d7dd7274d66d4f325392ae04b4d3606f95c9291bd665f99ffe569db5"
}
